[
  {
    "chunk_id": "CHK-KR-KDRI-2025-41NUTRIENTS",
    "source_id": "SRC-KR-MOHW-KDRI-2025-PR",
    "ingredient_ids": [],
    "locator_type": "lines",
    "locator_value": "L796-L817",
    "excerpt_summary_ko": "2025 한국인 영양소 섭취기준은 41개 영양소에 대해 연령·성별·생애주기 기준을 제공하며, 체계적 문헌평가를 거쳐 확정되었다.",
    "claim_type": "reference_framework",
    "structured_claim": {
      "nutrients_count": 41,
      "dimensions": [
        "age",
        "sex",
        "life_stage"
      ]
    },
    "confidence": "high",
    "notes_ko": "국내 기준 프레임워크의 최상위 anchor source."
  },
  {
    "chunk_id": "CHK-KR-MFDS-HFF-NOTICE-CATALOG",
    "source_id": "SRC-KR-MFDS-HFF-NOTICE-2025-11",
    "ingredient_ids": [],
    "locator_type": "lines",
    "locator_value": "L722-L736",
    "excerpt_summary_ko": "식약처 고시 제2025-11호는 건강기능식품의 기준 및 규격 최신 개정고시이며, 성분별 1일 섭취량·표시·주의사항 근거의 기본 진입점이다.",
    "claim_type": "regulatory_anchor",
    "structured_claim": {
      "notice_no": "2025-11",
      "revised_at": "2025-03-05"
    },
    "confidence": "high",
    "notes_ko": "세부 nutrient row 직접 파싱은 차기 단계."
  },
  {
    "chunk_id": "CHK-KR-FOODSAFETY-CAUTION-BOARD",
    "source_id": "SRC-KR-FOODSAFETY-CAUTION-BOARD",
    "ingredient_ids": [],
    "locator_type": "lines",
    "locator_value": "L8-L23",
    "excerpt_summary_ko": "식품안전나라에는 건강기능식품 섭취 주의사항과 의약품 병용 섭취 주의사항 게시판이 존재한다.",
    "claim_type": "regulatory_anchor",
    "structured_claim": {
      "contains": [
        "섭취 주의사항",
        "의약품 병용 섭취 주의사항"
      ]
    },
    "confidence": "high",
    "notes_ko": null
  },
  {
    "chunk_id": "CHK-US-ODS-UL-DEFINITION",
    "source_id": "SRC-US-ODS-NUTRIENT-REC",
    "ingredient_ids": [],
    "locator_type": "lines",
    "locator_value": "L112-L114",
    "excerpt_summary_ko": "UL은 일반적으로 유해 영향 가능성이 낮다고 보는 최대 일일 섭취량으로 정의된다.",
    "claim_type": "definition",
    "structured_claim": {
      "term": "UL",
      "definition": "Maximum daily intake unlikely to cause adverse health effects."
    },
    "confidence": "high",
    "notes_ko": null
  },
  {
    "chunk_id": "CHK-EU-EFSA-UL-DEFINITION",
    "source_id": "SRC-EU-EFSA-UL-SUMMARY-2025",
    "ingredient_ids": [],
    "locator_type": "lines",
    "locator_value": "P0 L1-L8",
    "excerpt_summary_ko": "EFSA UL summary report v11(2025)은 UL을 만성 총일일섭취량의 최대 수준으로 정의한다.",
    "claim_type": "definition",
    "structured_claim": {
      "term": "UL",
      "definition_scope": "total chronic daily intake from all dietary sources"
    },
    "confidence": "high",
    "notes_ko": null
  },
  {
    "chunk_id": "CHK-VITA-UL-US",
    "source_id": "SRC-US-ODS-VITAMIN-A",
    "ingredient_ids": [
      "vitamin_a_preformed"
    ],
    "locator_type": "lines",
    "locator_value": "L285-L293",
    "excerpt_summary_ko": "프리폼드 비타민 A의 성인 UL은 3,000 mcg/day이며, 이 UL은 retinol/retinyl ester에만 적용되고 beta-carotene에는 직접 적용되지 않는다.",
    "claim_type": "dose_limit",
    "structured_claim": {
      "jurisdiction": "US",
      "age_min": 19,
      "max_daily_intake": 3000,
      "unit": "mcg RAE/day",
      "scope": "preformed_only"
    },
    "confidence": "high",
    "notes_ko": null
  },
  {
    "chunk_id": "CHK-VITA-PREG-CAUTION",
    "source_id": "SRC-US-ODS-VITAMIN-A",
    "ingredient_ids": [
      "vitamin_a_preformed"
    ],
    "locator_type": "lines",
    "locator_value": "pregnancy warning / ODS lines around L276-L280",
    "excerpt_summary_ko": "임신 중이거나 임신 가능성이 있는 경우 비타민 A 보충제를 3,000 mcg RAE(10,000 IU) 초과로 복용하지 않도록 주의해야 한다.",
    "claim_type": "pregnancy_lactation",
    "structured_claim": {
      "pregnancy": "required",
      "avoid_over": 3000,
      "unit": "mcg RAE/day"
    },
    "confidence": "medium",
    "notes_ko": "ODS pregnancy caution lines 기반. 정확한 line locator는 후속 재추출 가능."
  },
  {
    "chunk_id": "CHK-BETACAR-SMOKER-RISK-ATBC",
    "source_id": "SRC-PMID-8127329",
    "ingredient_ids": [
      "beta_carotene"
    ],
    "locator_type": "abstract",
    "locator_value": "PubMed abstract results/conclusion",
    "excerpt_summary_ko": "남성 흡연자 RCT에서 beta-carotene 20 mg/day 보충은 폐암 발생 증가(18%)와 총사망 증가를 시사했다.",
    "claim_type": "adverse_effect_signal",
    "structured_claim": {
      "population": "male smokers",
      "dose": 20,
      "unit": "mg/day",
      "risk": "increased_lung_cancer"
    },
    "confidence": "high",
    "notes_ko": null
  },
  {
    "chunk_id": "CHK-BETACAR-SMOKER-RISK-GENERAL",
    "source_id": "SRC-US-ODS-VITAMIN-A",
    "ingredient_ids": [
      "beta_carotene"
    ],
    "locator_type": "lines",
    "locator_value": "lung cancer caution / ODS safety section",
    "excerpt_summary_ko": "ODS는 흡연자·과거 흡연자·석면 노출자에서 beta-carotene 고용량 보충이 폐암 위험 증가와 연관될 수 있음을 경고한다.",
    "claim_type": "population_caution",
    "structured_claim": {
      "smoking_status_any": [
        "current",
        "former"
      ],
      "exposure_any": [
        "asbestos"
      ],
      "avoid_high_dose": true
    },
    "confidence": "medium",
    "notes_ko": null
  },
  {
    "chunk_id": "CHK-VITD-UL-US",
    "source_id": "SRC-US-ODS-VITAMIN-D",
    "ingredient_ids": [
      "vitamin_d"
    ],
    "locator_type": "lines",
    "locator_value": "L473-L505",
    "excerpt_summary_ko": "성인 비타민 D UL은 100 mcg/day(4,000 IU/day)이다.",
    "claim_type": "dose_limit",
    "structured_claim": {
      "jurisdiction": "US",
      "age_min": 19,
      "max_daily_intake": 100,
      "unit": "mcg/day",
      "alt_unit": "4000 IU/day"
    },
    "confidence": "high",
    "notes_ko": null
  },
  {
    "chunk_id": "CHK-VITD-THIAZIDE",
    "source_id": "SRC-US-ODS-VITAMIN-D",
    "ingredient_ids": [
      "vitamin_d"
    ],
    "locator_type": "lines",
    "locator_value": "interaction section around thiazide diuretics",
    "excerpt_summary_ko": "thiazide 이뇨제와 vitamin D를 같이 쓰면 특히 고령·신기능장애·부갑상선기능항진 환자에서 고칼슘혈증 위험이 커질 수 있다.",
    "claim_type": "interaction",
    "structured_claim": {
      "medications_any": [
        "thiazide diuretic",
        "hydrochlorothiazide",
        "chlorthalidone"
      ],
      "risk": "hypercalcemia"
    },
    "confidence": "medium",
    "notes_ko": null
  },
  {
    "chunk_id": "CHK-VITD-ORLISTAT",
    "source_id": "SRC-US-ODS-VITAMIN-D",
    "ingredient_ids": [
      "vitamin_d"
    ],
    "locator_type": "lines",
    "locator_value": "interaction section around orlistat",
    "excerpt_summary_ko": "orlistat은 vitamin D 흡수를 감소시킬 수 있어 혈중 25(OH)D 상태와 보충 계획을 재검토해야 한다.",
    "claim_type": "interaction",
    "structured_claim": {
      "medications_any": [
        "orlistat"
      ],
      "effect": "reduced_absorption"
    },
    "confidence": "high",
    "notes_ko": null
  },
  {
    "chunk_id": "CHK-CALCIUM-UL-US",
    "source_id": "SRC-US-ODS-CALCIUM",
    "ingredient_ids": [
      "calcium"
    ],
    "locator_type": "lines",
    "locator_value": "L361-L370",
    "excerpt_summary_ko": "칼슘 성인 UL은 19–50세 2,500 mg/day, 51세 이상 2,000 mg/day이다.",
    "claim_type": "dose_limit",
    "structured_claim": {
      "jurisdiction": "US",
      "age_bands": [
        {
          "min": 19,
          "max": 50,
          "max_daily_intake": 2500
        },
        {
          "min": 51,
          "max": 200,
          "max_daily_intake": 2000
        }
      ],
      "unit": "mg/day"
    },
    "confidence": "high",
    "notes_ko": null
  },
  {
    "chunk_id": "CHK-CALCIUM-LEVOTHYROXINE",
    "source_id": "SRC-US-ODS-CALCIUM",
    "ingredient_ids": [
      "calcium"
    ],
    "locator_type": "lines",
    "locator_value": "interaction section around levothyroxine",
    "excerpt_summary_ko": "칼슘탄산염은 levothyroxine 흡수를 낮출 수 있어 일반적으로 4시간 이내 동시 복용을 피한다.",
    "claim_type": "timing_separation",
    "structured_claim": {
      "medications_any": [
        "levothyroxine"
      ],
      "separate_by_hours": 4
    },
    "confidence": "high",
    "notes_ko": null
  },
  {
    "chunk_id": "CHK-CALCIUM-QUINOLONE",
    "source_id": "SRC-US-ODS-CALCIUM",
    "ingredient_ids": [
      "calcium"
    ],
    "locator_type": "lines",
    "locator_value": "interaction section around quinolone antibiotics",
    "excerpt_summary_ko": "칼슘 보충제는 quinolone 항생제 흡수를 감소시킬 수 있어 시간 간격을 둔다.",
    "claim_type": "timing_separation",
    "structured_claim": {
      "medications_any": [
        "quinolone antibiotic",
        "ciprofloxacin",
        "levofloxacin",
        "moxifloxacin"
      ],
      "separate_hint": "take antibiotic at least 2h before or 4-6h after calcium"
    },
    "confidence": "medium",
    "notes_ko": null
  },
  {
    "chunk_id": "CHK-MAG-UL-US",
    "source_id": "SRC-US-ODS-MAGNESIUM",
    "ingredient_ids": [
      "magnesium_supplement"
    ],
    "locator_type": "lines",
    "locator_value": "L288-L304",
    "excerpt_summary_ko": "보충제/의약품 유래 마그네슘의 성인 UL은 350 mg/day이다.",
    "claim_type": "dose_limit",
    "structured_claim": {
      "jurisdiction": "US",
      "age_min": 19,
      "max_daily_intake": 350,
      "unit": "mg/day",
      "scope": "supplements_only"
    },
    "confidence": "high",
    "notes_ko": null
  },
  {
    "chunk_id": "CHK-MAG-UL-EU",
    "source_id": "SRC-EU-EFSA-UL-SUMMARY-2025",
    "ingredient_ids": [
      "magnesium_supplement"
    ],
    "locator_type": "table",
    "locator_value": "EFSA summary magnesium row",
    "excerpt_summary_ko": "EFSA는 readily dissociable magnesium salts in supplements 기준 성인 UL을 250 mg/day로 요약한다.",
    "claim_type": "dose_limit",
    "structured_claim": {
      "jurisdiction": "EU",
      "age_min": 19,
      "max_daily_intake": 250,
      "unit": "mg/day",
      "scope": "supplements_only"
    },
    "confidence": "high",
    "notes_ko": null
  },
  {
    "chunk_id": "CHK-MAG-ABX",
    "source_id": "SRC-US-ODS-MAGNESIUM",
    "ingredient_ids": [
      "magnesium_supplement"
    ],
    "locator_type": "lines",
    "locator_value": "L305-L307 + interaction detail",
    "excerpt_summary_ko": "마그네슘은 tetracycline/quinolone 항생제와 결합해 흡수를 낮출 수 있어 시간 간격이 필요하다.",
    "claim_type": "timing_separation",
    "structured_claim": {
      "medications_any": [
        "tetracycline antibiotic",